{
  "$schema": "https://json-schema.org/draft/2020-12/schema",
  "$id": "https://raw.githubusercontent.com/pupa-app/marketplace/main/schemas/metadata.schema.json",
  "title": "Pupa app metadata.json",
  "description": "Per-app metadata contributors hand-write. See CONTRIBUTING.md and docs/spec.md. Enforced by scripts/validate.py.",
  "type": "object",
  "additionalProperties": false,
  "required": ["id", "version", "author", "summary", "tags"],
  "properties": {
    "id": {
      "type": "string",
      "pattern": "^[a-z0-9][a-z0-9-]{1,63}$",
      "description": "App slug; must equal the apps/<slug>/ directory name."
    },
    "version": {
      "type": "integer",
      "minimum": 1,
      "description": "Catalog entry version; bump on every change to app.pupa."
    },
    "author": { "type": "string", "minLength": 1 },
    "summary": { "type": "string", "minLength": 1, "maxLength": 200 },
    "tags": {
      "type": "array",
      "maxItems": 8,
      "items": { "type": "string", "pattern": "^[a-z0-9-]+$" }
    },
    "homepage": { "type": "string", "pattern": "^https://" },
    "license": {
      "type": "string",
      "minLength": 1,
      "maxLength": 100,
      "description": "Content license for this app (SPDX id or short name). Omit for the repo default (CC0-1.0, see CONTENT-LICENSE). Set only if you hold the rights to release under it."
    },
    "attribution": {
      "type": "string",
      "minLength": 1,
      "maxLength": 500,
      "description": "Required credit line + link when the license demands attribution (e.g. CC BY / BY-NC-SA)."
    },
    "order": {
      "type": "integer",
      "description": "Catalog sort weight. Apps sort by (order, id) ascending; omit for the default of 0 (sorts alphabetically by id among other order:0 apps). Higher pushes later in the listing."
    }
  }
}
