{
  "id": "product-event-finder",
  "version": 2,
  "author": "pupa-app",
  "summary": "Find any product or event: searches sellers, browser-verifies real stock, legitimacy-checks unknown sites, and tracks results. Then preps checkout!",
  "tags": ["shopping", "search", "tracker", "events", "tickets"],
  "homepage": "https://github.com/pupa-app/pupa"
}
