{
  "id": "research-tracker",
  "version": 1,
  "author": "pupa-app",
  "summary": "Competitive-intel watchlist, weekly findings log, signal-trend chart, and a Scout/Analyst/Digest research room.",
  "tags": ["research", "competitive-intel", "dashboard"],
  "homepage": "https://github.com/pupa-app/pupa"
}
